"Bug ID","Type","Summary","Product","Component","Assignee","Status","Resolution","Updated"
1354153,"defect","Lightning stores only one account for caldav - impossible to have 2 calenders from same domain.","Calendar","Provider: CalDAV","nobody","UNCONFIRMED"," ---","2020-12-17 09:49:15"
1359368,"defect","EGroupware calendar in Lightning drops events after some syncs","Calendar","Provider: CalDAV","nobody","UNCONFIRMED"," ---","2018-09-22 12:15:19"
1360070,"defect","Attempted adding new event and hung. After startup, could not open calendar and tasks","Calendar","General","nobody","UNCONFIRMED"," ---","2020-10-04 02:52:47"
1361292,"defect","Accepting an invite using a CalDAV calendar multiple problems","Calendar","General","nobody","UNCONFIRMED"," ---","2017-11-22 11:27:49"
1361420,"defect","Alarm for recurring event on network calendar cannot be dismissed","Calendar","Alarms","nobody","UNCONFIRMED"," ---","2020-09-12 08:03:30"
1361658,"enhancement","""Convert to Event"" should (optionally) add attendees","Calendar","General","nobody","UNCONFIRMED"," ---","2020-09-19 04:48:21"
1362121,"enhancement","Support new RFC-7986 COLOR property","Calendar","Internal Components","nobody","UNCONFIRMED"," ---","2020-09-21 09:22:54"
1364780,"defect","All day calendar events - bug on Today Pane (timezone related bug?)","Calendar","General","nobody","UNCONFIRMED"," ---","2017-05-31 03:57:55"
1365258,"defect","Calendar Date Text Format incorrect for long dates in pt_BR Thunderbird 45.x and 52.x for Windows","Calendar","General","nobody","UNCONFIRMED"," ---","2017-06-07 05:02:33"
1365883,"defect","Password manager saves multiple logins for the same ""site""","Calendar","Provider: CalDAV","nobody","UNCONFIRMED"," ---","2017-05-22 01:36:24"
1365905,"defect","Sometime Convert to Even/Task does not work in thunderbird version 52.1.1 (32-bit)","Calendar","General","nobody","UNCONFIRMED"," ---","2021-02-20 02:12:26"
1366463,"defect","Thunderbird/Lightning CalDav Login always with cross-site warning","Calendar","Provider: CalDAV","nobody","UNCONFIRMED"," ---","2017-07-30 02:01:38"
1367021,"defect","Missing information in password prompt to identify the calendar the password is requested for","Calendar","General","nobody","UNCONFIRMED"," ---","2017-05-23 09:37:44"
1367381,"defect","CalDav sync not working with Nextcloud 12.0.0.","Calendar","Provider: CalDAV","nobody","UNCONFIRMED"," ---","2018-10-16 07:57:19"
1368903,"defect","Calendar some times doesn't ask before sending notifications","Calendar","General","nobody","UNCONFIRMED"," ---","2017-06-01 20:54:51"
1370160,"enhancement","Add a Map to setup geo coordinates as Meetingpoint","Calendar","Dialogs","nobody","UNCONFIRMED"," ---","2019-02-09 06:49:41"
1370363,"defect","""An error occurred when writing to the calendar XYZ""","Calendar","General","nobody","UNCONFIRMED"," ---","2017-10-02 01:17:46"
1376757,"defect","Rendering error in Lightning of attendees availability overview","Calendar","Dialogs","nobody","UNCONFIRMED"," ---","2020-09-26 02:57:52"
1376787,"defect","Combined display of CalDAV events in different calendars but same UID","Calendar","Calendar Frontend","nobody","UNCONFIRMED"," ---","2018-11-14 01:53:06"
1377212,"defect","Lightning dos not synchronize to davical server","Calendar","Provider: CalDAV","nobody","UNCONFIRMED"," ---","2017-08-17 05:49:32"
1377647,"defect","Lightning: CalDav calendars disabled (Status 401); using NextCloud on the server","Calendar","Provider: CalDAV","nobody","UNCONFIRMED"," ---","2017-07-07 02:35:51"
1377763,"defect","Specifying start and end of events in separate time zones","Calendar","Dialogs","nobody","UNCONFIRMED"," ---","2020-10-13 10:24:32"
1377764,"enhancement","Changing time zone when traveling","Calendar","General","nobody","UNCONFIRMED"," ---","2017-07-02 12:38:43"
1378220,"defect","No option to confirm a meeting invite","Calendar","E-mail based Scheduling (iTIP/iMIP)","nobody","UNCONFIRMED"," ---","2020-09-22 10:19:27"
1379057,"defect","Reminder not set at the receipient when accepting invitation","Calendar","E-mail based Scheduling (iTIP/iMIP)","nobody","UNCONFIRMED"," ---","2020-09-22 10:16:40"
1379777,"defect","keyboard shortcut save & close (ctrl+L) not working for event/task in tab","Calendar","Dialogs","nobody","UNCONFIRMED"," ---","2017-07-10 13:44:13"
1385549,"defect","Email's calendar controls get in the way","Calendar","E-mail based Scheduling (iTIP/iMIP)","nobody","UNCONFIRMED"," ---","2017-10-08 07:14:07"
1387041,"defect","missing parallel timelines of several agendas","Calendar","Calendar Frontend","nobody","UNCONFIRMED"," ---","2017-08-03 06:16:49"
1388613,"enhancement","Enhancement to show recently used snooze times in reminder popup","Calendar","Alarms","nobody","UNCONFIRMED"," ---","2017-08-08 22:29:08"
1390085,"defect","add event dialog box displayed only partly on win10","Calendar","Dialogs","nobody","UNCONFIRMED"," ---","2020-09-26 02:35:01"
1393810,"enhancement","Remove Dialogue Box for Task Editing (Feature Request)","Calendar","Tasks","nobody","UNCONFIRMED"," ---","2017-10-08 07:22:41"
1394384,"defect","Problem adding new CalDAV calendar","Calendar","Provider: CalDAV","nobody","UNCONFIRMED"," ---","2017-08-28 05:11:11"
1397664,"defect","Cannot change date of events with CalDAV based calendars.","Calendar","Provider: CalDAV","nobody","UNCONFIRMED"," ---","2017-09-07 01:30:21"
1399587,"defect","Migrate calendar items from Lighthing(Windows) to Lightning(Linux), using *.ical-files","Calendar","Import and Export","nobody","UNCONFIRMED"," ---","2017-09-14 04:54:21"
1399726,"enhancement","Lightning: automatically enter events from known email addresses","Calendar","E-mail based Scheduling (iTIP/iMIP)","nobody","UNCONFIRMED"," ---","2019-10-21 09:37:46"
1401478,"defect","event reminders fire an hour late","Calendar","Alarms","nobody","UNCONFIRMED"," ---","2020-09-22 10:15:40"
1402354,"defect","Deleting one appointment of a repeating appointment from a network-based calendar Thunderbird will still display it, unable to delete","Calendar","Provider: CalDAV","nobody","UNCONFIRMED"," ---","2017-09-22 15:31:41"
1403496,"defect","calendar.network.multirealm disables whole CalDAV usage","Calendar","Provider: CalDAV","nobody","UNCONFIRMED"," ---","2020-09-16 03:53:38"
1404830,"defect","Deleting Multiple Tasks: MODIFICATION_FAILED ""An error occurred when writing to the calendar ...""","Calendar","Tasks","nobody","UNCONFIRMED"," ---","2017-10-08 03:39:12"
1406292,"defect","cannot dismiss or snoze alarms from calendar","Calendar","Alarms","nobody","UNCONFIRMED"," ---","2017-12-28 12:25:56"
1407187,"defect","Today highlighting is not visible enough","Calendar","Calendar Frontend","nobody","UNCONFIRMED"," ---","2017-11-16 00:56:38"
1410007,"defect","Error when creating /opening an entry linked on Google Calendar","Calendar","General","nobody","UNCONFIRMED"," ---","2017-10-26 22:17:51"
1412321,"defect","Forward email with an ICS replaces the message with ICS details only","Calendar","E-mail based Scheduling (iTIP/iMIP)","nobody","UNCONFIRMED"," ---","2017-11-04 08:34:37"
1413245,"defect","Calendar is Freezing if a specific event is opened [TypeError: rule.untilDate is undefined]","Calendar","Dialogs","nobody","UNCONFIRMED"," ---","2017-11-04 08:35:39"
1413549,"defect","How-to edit Lightning print template?","Calendar","Printing","nobody","UNCONFIRMED"," ---","2017-11-06 00:10:45"
1420057,"defect","Mozilla Calendar project - Lightning Calendar V5.4 not printing","Calendar","Printing","nobody","UNCONFIRMED"," ---","2018-05-05 09:10:22"
1420243,"defect","Some events (anniversary, death date) are not imported from a Nextcloud CalDAV server","Calendar","Provider: CalDAV","nobody","UNCONFIRMED"," ---","2017-12-01 02:20:03"
1420503,"defect","Unable to re-open Reminder window","Calendar","Alarms","nobody","UNCONFIRMED"," ---","2018-03-23 01:59:07"
1423540,"defect","Unable to save credentials for multiple accounts on same domain","Calendar","Provider: CalDAV","nobody","UNCONFIRMED"," ---","2017-12-06 10:25:26"
1424860,"defect","calendar deletes all server side calender entries after client was offline for a while","Calendar","Provider: CalDAV","nobody","UNCONFIRMED"," ---","2020-09-22 10:13:25"
1425388,"defect","Events in forwarded messages automatically added to calendar.","Calendar","E-mail based Scheduling (iTIP/iMIP)","nobody","UNCONFIRMED"," ---","2020-09-22 10:11:27"
1425448,"defect","Seemingly there is no way to go from the day pane to the main calendar view!","Calendar","General","nobody","UNCONFIRMED"," ---","2020-11-18 02:49:41"
1426974,"defect","Search missing items (unifinder)","Calendar","Calendar Frontend","nobody","UNCONFIRMED"," ---","2020-09-23 03:23:46"
1427207,"defect","Import of *.ics file results in 2 hrs time difference","Calendar","Import and Export","nobody","UNCONFIRMED"," ---","2019-07-25 00:47:22"
1427523,"defect","Calendar weekly display is broken in Hebrew (and most likely other RTL languages)","Calendar","Calendar Frontend","nobody","UNCONFIRMED"," ---","2020-09-22 10:09:15"
1427588,"defect","webcal calendar does not work","Calendar","General","nobody","UNCONFIRMED"," ---","2018-01-03 00:45:04"
1427671,"defect","Wrong instances for events starting Sunday and recurring on multiple weekdays every n weeks","Calendar","Internal Components","nobody","UNCONFIRMED"," ---","2018-01-02 19:42:51"
1428101,"defect","after sync alarm does not work","Calendar","Alarms","nobody","UNCONFIRMED"," ---","2018-01-04 09:49:17"
1428254,"defect","Calendar event delete does not confirm, has no undo","Calendar","General","nobody","UNCONFIRMED"," ---","2020-09-19 04:54:55"
1432369,"defect","Not receiving reminders for new events but still receiving reminders for deleted events","Calendar","Alarms","nobody","UNCONFIRMED"," ---","2020-09-16 03:52:31"
1433639,"defect","DST not considered when creating events specifying a timezone","Calendar","Provider: CalDAV","nobody","UNCONFIRMED"," ---","2019-01-04 13:36:48"
1434272,"defect","Replay action failed when adding CalDAV calendar with calendar.network.multirealm enabled","Calendar","Provider: CalDAV","nobody","UNCONFIRMED"," ---","2020-09-10 01:46:34"
1436664,"defect","Creating new ICS cal (posteo.de) fails with ""Component returned failure code: 0x804a0104 [calIDateTime.icalString]""","Calendar","General","nobody","UNCONFIRMED"," ---","2018-02-14 12:14:20"
1437220,"defect","When you add attendees the box for separate invitation per attendee grayed out","Calendar","E-mail based Scheduling (iTIP/iMIP)","nobody","UNCONFIRMED"," ---","2020-08-30 04:14:01"
1437278,"defect","Lightning not enabling multiple CalDav accounts (similar to bug 707138)","Calendar","Provider: CalDAV","nobody","UNCONFIRMED"," ---","2018-02-10 10:24:06"
1439113,"defect","a deleted calendar item keeps popping up","Calendar","General","nobody","UNCONFIRMED"," ---","2020-10-04 02:55:09"
1440742,"enhancement","configure custom lightning notification","Calendar","Alarms","nobody","UNCONFIRMED"," ---","2020-09-16 03:51:52"
1442904,"defect","show attendance of myself in calendar entries","Calendar","Calendar Frontend","nobody","UNCONFIRMED"," ---","2018-03-03 09:41:00"
1443326,"enhancement","Two missing features in thunderbird calendar - category shortcuts and events spanning several days","Calendar","Calendar Frontend","nobody","UNCONFIRMED"," ---","2018-03-06 02:03:06"
1446991,"defect","Thunderbird fails when calendar tab is dragged when opening (TypeError: getBrowser(...) is null)","Calendar","General","nobody","UNCONFIRMED"," ---","2018-03-20 02:56:32"
1447456,"defect","Recurring event not listed in Network Calendar (caldav) event list - Thunderbird Calendar (Lightning)","Calendar","Provider: CalDAV","nobody","UNCONFIRMED"," ---","2018-03-21 04:00:40"
1450716,"defect","Calendar: MODIFICATION_FAILED","Calendar","General","nobody","UNCONFIRMED"," ---","2018-04-06 16:48:31"
1451867,"defect","Caldav calender destroyed after sync with lightning 5.4 and 5.4.7","Calendar","Provider: CalDAV","nobody","UNCONFIRMED"," ---","2019-01-23 11:29:52"
1453064,"defect","Select 'Category' and 'Add a new category' then I can't use that new category for any other tasks. Must create the same category name again.","Calendar","Tasks","nobody","UNCONFIRMED"," ---","2018-04-11 08:32:15"
1455000,"defect","possibility to define a date by displacement from an other date","Calendar","General","nobody","UNCONFIRMED"," ---","2020-06-22 06:11:54"
1455018,"defect","task do dot show correctly the progress value on remote calendar","Calendar","Tasks","nobody","UNCONFIRMED"," ---","2018-04-19 06:40:46"
1455228,"enhancement","default calendar accept action should be settable","Calendar","E-mail based Scheduling (iTIP/iMIP)","nobody","UNCONFIRMED"," ---","2020-09-21 13:11:32"
1455552,"defect","duplicate events with remote calender and offline support","Calendar","Calendar Frontend","nobody","UNCONFIRMED"," ---","2018-05-05 05:49:53"
1457185,"enhancement","Display ""repeated appointments"". with selectable end date. (Kalender Suchfunktion ""Alle Termine"" verbessern)","Calendar","Calendar Frontend","nobody","UNCONFIRMED"," ---","2020-09-21 13:09:54"
1459540,"defect","Can not accept calendar meeting invitation","Calendar","E-mail based Scheduling (iTIP/iMIP)","nobody","UNCONFIRMED"," ---","2020-09-21 12:47:00"
1462599,"defect","UTC missing in time zone picker (again)","Calendar","General","nobody","UNCONFIRMED"," ---","2018-06-17 06:21:40"
1464774,"defect","Sometimes, Calendar doesn't save dismiss or anything","Calendar","Alarms","nobody","UNCONFIRMED"," ---","2018-05-28 05:06:29"
1466421,"enhancement","Lightning calendar notifications that stay on top of other applications?","Calendar","Alarms","nobody","UNCONFIRMED"," ---","2018-06-18 09:05:35"
1467367,"enhancement","Guess a user moved to another timezone by detecting just eleapsed events with different timezones for start and end date and prompt the user on whether to switch the Lightning default timezone","Calendar","General","nobody","UNCONFIRMED"," ---","2018-07-30 07:25:01"
1467977,"defect","Slow startup with Lightning enabled and profile folder on a network location (NAS).   (5-15sec on local drive, 15-50sec on NAS, 5sec less in safe mode)","Calendar","General","nobody","UNCONFIRMED"," ---","2019-04-15 03:24:21"
1469829,"defect","Last Reminder Won't Snooze","Calendar","Alarms","nobody","UNCONFIRMED"," ---","2018-06-20 10:32:48"
1474237,"enhancement","Indicate events outside of current visible part of the view","Calendar","Calendar Frontend","nobody","UNCONFIRMED"," ---","2020-09-21 12:45:08"
1474708,"defect","Calendar: Google accounts not retained","Calendar","Provider: CalDAV","nobody","UNCONFIRMED"," ---","2018-07-11 11:58:31"
1480642,"defect","Lightning Caldav offline events caching doesn't work","Calendar","Provider: CalDAV","nobody","UNCONFIRMED"," ---","2018-10-08 14:29:19"
1485594,"defect","Creating an event in Nextcloud shared calendar is very slow","Calendar","Provider: CalDAV","nobody","UNCONFIRMED"," ---","2020-01-19 22:57:10"
1489055,"defect","Text Selection no longer shown when mouse leaves Lightning","Calendar","General","nobody","UNCONFIRMED"," ---","2019-09-02 08:29:27"
1493433,"defect","Asynchronous free/busy requests break [NS_NOINTERFACE: Component does not have requested interface [calIOperation.id] calendar-event-dialog-attendees.js]","Calendar","General","nobody","UNCONFIRMED"," ---","2018-09-24 01:46:05"
1496644,"defect","can't edit event for change of CalDAV calendar","Calendar","Provider: CalDAV","nobody","UNCONFIRMED"," ---","2019-02-20 09:02:05"
1498843,"defect","undo / restore from trash calendar an event deleted using keyboard shortcut","Calendar","General","nobody","UNCONFIRMED"," ---","2020-07-06 11:03:31"
1499392,"defect","Improvement: CalDAV syncing problems should be reported to user","Calendar","Provider: CalDAV","nobody","UNCONFIRMED"," ---","2018-10-16 07:57:37"
1502213,"defect","Proposal to improve the visibility of the calendar","Calendar","Calendar Frontend","nobody","UNCONFIRMED"," ---","2018-10-25 15:24:19"
1502364,"defect","CalDav appointments have 'No Reminder' set","Calendar","Alarms","nobody","UNCONFIRMED"," ---","2018-11-23 13:30:53"
1502399,"defect","Lighning sends notificataions despite being told not to","Calendar","E-mail based Scheduling (iTIP/iMIP)","nobody","UNCONFIRMED"," ---","2018-11-08 03:49:24"
1504738,"defect","Overwriting entry in calendar","Calendar","General","nobody","UNCONFIRMED"," ---","2018-11-16 04:57:49"
1504851,"defect","Lighting failing to completely display details of calendar events that contain a timezone that is not recognized by Thunderbird.","Calendar","Dialogs","nobody","UNCONFIRMED"," ---","2018-11-18 07:56:24"
1506164,"defect","Lightning calendar event disappering on sync and other issues after TB upgrade","Calendar","Provider: CalDAV","nobody","UNCONFIRMED"," ---","2018-11-12 06:01:51"
1508339,"defect","Allow default to Local Time when adding new events to calendar","Calendar","Preferences","nobody","UNCONFIRMED"," ---","2020-09-19 04:55:46"
1509700,"defect","Lightning can't handle the .ics file attached to a notificiation email from iCloud","Calendar","E-mail based Scheduling (iTIP/iMIP)","nobody","UNCONFIRMED"," ---","2021-03-23 16:56:47"
1511608,"defect","Event alarm snooze fails when 3 or more hours selected, or after multiple snoozes.","Calendar","Alarms","nobody","UNCONFIRMED"," ---","2020-09-12 10:50:16"
1511638,"defect","Recurring events put days in wrong week if week start setting is not Monday","Calendar","General","nobody","UNCONFIRMED"," ---","2018-12-01 10:15:09"
1511822,"defect","Thunderbird 60.x.x with Lightning unusable, showing 'Unresponsive script'","Calendar","Internal Components","nobody","UNCONFIRMED"," ---","2020-09-19 04:56:12"
1511962,"defect","Incorrect timezone conversion for event when converting an invite to an event","Calendar","Dialogs","nobody","UNCONFIRMED"," ---","2018-12-04 04:21:28"
1512379,"defect","Thunderbird freezes when using network calendars","Calendar","General","nobody","UNCONFIRMED"," ---","2019-08-07 23:29:11"
1512703,"defect","Lightning Calendar times don't match time zone in Day or Week View (Multiweek and Month are OK)","Calendar","General","nobody","UNCONFIRMED"," ---","2019-01-18 07:56:55"
1514077,"defect","Cannot set the time in new events","Calendar","General","nobody","UNCONFIRMED"," ---","2020-09-19 04:57:57"
1515123,"defect","devtools network response from a Lightning REPORT request loads very slowly (long delay) with UI freeze/not responding","Calendar","General","nobody","UNCONFIRMED"," ---","2020-06-09 17:41:28"
1516207,"defect","Lightning copy/paste events date changed","Calendar","General","nobody","UNCONFIRMED"," ---","2020-10-04 02:55:55"
1516378,"defect","more than one CalDAV network calendar: enter password dialog does not show","Calendar","Provider: CalDAV","nobody","UNCONFIRMED"," ---","2018-12-30 10:41:44"
1516858,"defect","New event added to google calendar does not use local time zone","Calendar","General","nobody","UNCONFIRMED"," ---","2018-12-30 02:36:37"
1517186,"defect","Lightning - snooze all for 2+ alarm items only snooze the first","Calendar","Alarms","nobody","UNCONFIRMED"," ---","2019-01-01 23:33:26"
1518012,"defect","Calendar connection with Lightning/Thunderbird fails - 401 unauthorized","Calendar","Provider: CalDAV","nobody","UNCONFIRMED"," ---","2019-06-10 07:41:37"
1518014,"defect","Calendar is doing anonymous login for ftp server with stored credentials","Calendar","General","nobody","UNCONFIRMED"," ---","2021-04-06 13:39:13"
1518413,"defect","Reminder window is shown off-screen","Calendar","Alarms","nobody","UNCONFIRMED"," ---","2019-01-08 07:37:18"
1518678,"defect","Event custom snooze dialog shows, doesn't accept interval units.","Calendar","Dialogs","nobody","UNCONFIRMED"," ---","2019-01-09 09:57:49"
1519964,"defect","Reminder list is not refreshed properly when coming out of sleep is the reminder was already dismissed","Calendar","Alarms","nobody","UNCONFIRMED"," ---","2019-01-14 11:26:49"
1520345,"defect","Calendar Invite causes console error ""..does not match timezone offset for...""","Calendar","General","nobody","UNCONFIRMED"," ---","2019-06-10 07:59:42"
1520766,"defect","Lightning breaks ICS format after import (dublicates ATTACH;VALUE=URI:Chord)","Calendar","Provider: CalDAV","nobody","UNCONFIRMED"," ---","2019-01-17 23:16:51"
1520848,"defect","Cannot change end date on Lightning event","Calendar","Dialogs","nobody","UNCONFIRMED"," ---","2020-09-23 14:55:50"
1520959,"defect","Invitation Reminders Are Not Imported if an Invitation is Accepted","Calendar","Alarms","nobody","UNCONFIRMED"," ---","2019-01-17 15:50:47"
1521303,"defect","Calendar items with multiple attachments displayed incorrectly","Calendar","E-mail based Scheduling (iTIP/iMIP)","nobody","UNCONFIRMED"," ---","2020-09-21 12:29:59"
1522801,"defect","iCalendar sync slow under win 8.1","Calendar","General","nobody","UNCONFIRMED"," ---","2019-08-07 23:48:58"
1523459,"defect","Invites are accepted using the wrong email address","Calendar","E-mail based Scheduling (iTIP/iMIP)","nobody","UNCONFIRMED"," ---","2020-03-22 03:59:47"
1523512,"defect","wrong time for calendar events because of daylight savings","Calendar","General","nobody","UNCONFIRMED"," ---","2019-02-09 12:57:29"
1524055,"defect","Message text and calendar event of accepted invite does not match identity used for reply","Calendar","E-mail based Scheduling (iTIP/iMIP)","nobody","UNCONFIRMED"," ---","2019-04-08 05:16:12"
1524397,"enhancement","Provide an abiliity to control alarm volume within Thunderbird","Calendar","Preferences","nobody","UNCONFIRMED"," ---","2020-09-12 02:55:16"
1524811,"defect","Snooze all no longer works.  I can snooze individually though.","Calendar","Alarms","nobody","UNCONFIRMED"," ---","2019-02-27 15:48:29"
1524847,"defect","Make reminders less obnoxious","Calendar","Tasks","nobody","UNCONFIRMED"," ---","2019-11-14 14:28:44"
1526784,"defect","Problem setting event time","Calendar","Dialogs","nobody","UNCONFIRMED"," ---","2019-05-13 04:43:34"
1527549,"enhancement","allow user to hide cancelled events","Calendar","Calendar Frontend","nobody","UNCONFIRMED"," ---","2020-10-08 03:27:49"
1527775,"defect",".ics files stopped working with Thunderbird / Lightning","Calendar","E-mail based Scheduling (iTIP/iMIP)","nobody","UNCONFIRMED"," ---","2020-01-05 03:02:49"
1527869,"defect","false reminders for event with Multiple Reminders","Calendar","Alarms","nobody","UNCONFIRMED"," ---","2019-02-14 03:41:01"
1528291,"defect","This message contains an event that this version of Lightning cannot process","Calendar","E-mail based Scheduling (iTIP/iMIP)","nobody","UNCONFIRMED"," ---","2019-04-15 12:01:56"
1530703,"defect","Meeting invitation to single event in a series cannot be accepted and sends continuous reminders","Calendar","E-mail based Scheduling (iTIP/iMIP)","nobody","UNCONFIRMED"," ---","2020-09-21 12:25:42"
1531301,"defect","Continuous update loop with GMX calendar","Calendar","Provider: CalDAV","nobody","UNCONFIRMED"," ---","2019-03-19 17:06:18"
1532153,"defect","the option elements should made hidden/show (collapse).","Calendar","Dialogs","nobody","UNCONFIRMED"," ---","2019-03-10 15:11:43"
1532564,"defect","Adding an event by accepting an invitation breaks with ""No value for SUMMARY""","Calendar","E-mail based Scheduling (iTIP/iMIP)","nobody","UNCONFIRMED"," ---","2019-09-18 05:32:43"
1535148,"defect","print scaling not working","Calendar","Printing","nobody","UNCONFIRMED"," ---","2019-03-13 14:13:23"
1536422,"defect","Cannot change time or date in repeated events in Lightning 6.2.5.3 / Mac","Calendar","General","nobody","UNCONFIRMED"," ---","2019-03-25 12:02:35"
1538310,"defect","Events with text field ending with char ""à"" (a grave) disappear","Calendar","Provider: CalDAV","nobody","UNCONFIRMED"," ---","2020-10-17 01:32:55"
1539253,"defect","Grid with small height","Calendar","Calendar Frontend","nobody","UNCONFIRMED"," ---","2019-03-26 12:46:46"
1540512,"enhancement","Enable display of multiple time zones in Lightning Calendar views","Calendar","Calendar Frontend","nobody","UNCONFIRMED"," ---","2020-04-14 12:18:16"
1540572,"defect","icalendar COLOR Property is marked as PROPERTY-PARSE-ERROR","Calendar","Internal Components","nobody","UNCONFIRMED"," ---","2020-09-21 09:22:18"
1542540,"enhancement","Want to edit read-only calendar entries","Calendar","General","nobody","UNCONFIRMED"," ---","2020-08-30 04:21:54"
1543405,"enhancement","Add Vertical View Layout for Tasks Tab","Calendar","Tasks","nobody","UNCONFIRMED"," ---","2020-09-21 09:20:50"
1543556,"enhancement","Multiple entries for the same meeting","Calendar","E-mail based Scheduling (iTIP/iMIP)","nobody","UNCONFIRMED"," ---","2019-04-11 08:33:50"
1543716,"defect","When clicking on a recurring event in the calendar view (e.g Month view), event does not appear selected in the Find Events > All Events list view","Calendar","Calendar Frontend","nobody","UNCONFIRMED"," ---","2020-04-26 07:43:50"
1543953,"defect","Lightning network REPORT request receiving time too high (0.5 to 3 seconds per request) - Loading one ~4000 events network calendar takes more than 1 minute - 46 network requests required (isn't it too much?)","Calendar","Provider: CalDAV","nobody","UNCONFIRMED"," ---","2020-10-15 10:54:51"
1544134,"defect","Can't edit reminder length for Event Invitations received from Someone using Outlook","Calendar","Dialogs","nobody","UNCONFIRMED"," ---","2019-04-12 14:45:08"
1544279,"enhancement","Add ""Multiple Categories"" (with grey hex triplet color: 808080) to Preferences -> Calendar -> Categories","Calendar","Preferences","nobody","UNCONFIRMED"," ---","2019-06-03 10:15:11"
1544280,"enhancement","Make all colors unique in Preferences -> Calendar -> Categories","Calendar","Preferences","nobody","UNCONFIRMED"," ---","2019-04-15 03:57:51"
