"Bug ID","Type","Summary","Product","Component","Assignee","Status","Resolution","Updated"
476267,"enhancement","Support unusual |URL;VALUE=URI:http://example.com/| syntax from iCal.app","Calendar","Internal Components","nobody","NEW"," ---","2010-04-15 12:38:58"
478874,"enhancement","simple drag and drop of tasks in calender should set the due date","Calendar","General","nobody","NEW"," ---","2020-09-19 07:45:12"
479896,"defect","Password failures due to password changes need alerts, and different schedule","Calendar","General","nobody","NEW"," ---","2015-02-23 05:34:28"
480710,"defect","Recurring Tasks which cross month borders handled badly","Calendar","General","nobody","NEW"," ---","2010-06-28 10:12:47"
481021,"enhancement","Allow easy access to resource and location principals and calendars [meta]","Calendar","Internal Components","nobody","NEW"," ---","2020-05-19 06:58:05"
481837,"enhancement","Sort all-day events in same order as Calendar List","Calendar","Calendar Frontend","nobody","NEW"," ---","2016-11-16 13:04:49"
482115,"defect","""Date Text Format"" has long and short date format wrong (switched, swapped)","Calendar","Preferences","nobody","NEW"," ---","2019-05-05 04:53:13"
482704,"defect","Recurring events that occur on day 30 or 31 may get skipped on months having < 30-31 days","Calendar","General","nobody","NEW"," ---","2020-09-05 06:36:03"
484034,"defect","signed imip: Unable to view e-mail contents or view attachment with some Lotus Notes ics","Calendar","E-mail based Scheduling (iTIP/iMIP)","nobody","NEW"," ---","2014-11-24 00:59:00"
484354,"defect","Alarm Service shouldn't have a timezone attribute","Calendar","Alarms","nobody","NEW"," ---","2012-03-27 00:02:09"
486700,"defect","Get rid of capabilities.alarms.popup.supported, think of suppressAlarms","Calendar","Alarms","nobody","NEW"," ---","2009-04-05 14:40:03"
486773,"defect","Ambiguous error - ""Failed to parse item:""","Calendar","Provider: CalDAV","nobody","NEW"," ---","2014-09-28 05:03:55"
487206,"enhancement","Revise Text for ""Accept"" button in Provider Uninstall Dialog","Calendar","Calendar Frontend","nobody","NEW"," ---","2020-12-04 13:47:54"
487627,"enhancement","Create and register error string bundles for calendar errors","Calendar","Internal Components","nobody","NEW"," ---","2009-04-09 08:43:08"
488261,"enhancement","New task/event should use the selected text as a title when converting a message","Calendar","General","nobody","NEW"," ---","2020-09-19 07:45:32"
489747,"defect","Support PERIOD RDATE properties","Calendar","Internal Components","nobody","NEW"," ---","2017-02-15 04:47:19"
489850,"defect","Make ICS parser more error-tolerant (i.e ignore null character (^@))","Calendar","Import and Export","nobody","NEW"," ---","2017-10-05 21:06:31"
492099,"enhancement","Option to not refresh a remote calendar at startup","Calendar","General","nobody","NEW"," ---","2011-07-25 12:59:12"
496889,"defect","past alarms should be ignored, at least by default","Calendar","Alarms","nobody","NEW"," ---","2021-03-17 03:15:12"
497796,"enhancement","Enhanced Calendar & Category Properties","Calendar","General","nobody","NEW"," ---","2011-03-19 11:31:17"
498968,"defect","Create a new, faster storage ""storage2"" provider","Calendar","Provider: Local Storage","nobody","NEW"," ---","2019-09-04 22:08:29"
499474,"defect","Task operations can be done when selecting a task and then changing modes","Calendar","Tasks","nobody","NEW"," ---","2010-03-20 08:58:45"
499475,"defect","Task in Today Pane in Mail mode does not allow editing using the 'Events and Tasks' menu","Calendar","Tasks","nobody","NEW"," ---","2009-06-20 09:55:53"
499476,"defect","Text color is wrong for menus that use the ""task-priority"" and ""task-progress"" binding.","Calendar","Tasks","nobody","NEW"," ---","2009-06-23 09:07:41"
499478,"defect","Can't set priority for events from the new ""Events and Tasks"" menu","Calendar","General","nobody","NEW"," ---","2009-06-20 09:56:27"
499480,"defect","Create binding or menu items for setting status and privacy from the events and tasks menu","Calendar","General","nobody","NEW"," ---","2009-06-23 09:08:25"
500235,"defect","When accepting invitation to event, dialog to select calendar is empty","Calendar","General","nobody","NEW"," ---","2020-09-19 07:47:27"
500468,"defect","Export Options - Date Range and expand occurrence for csv","Calendar","Import and Export","nobody","NEW"," ---","2019-08-05 00:21:10"
501005,"enhancement","Allow reduced event/task/invite attendees dialog window width/height (for smaller screen resolutions)","Calendar","Dialogs","nobody","NEW"," ---","2010-03-31 13:44:03"
501338,"defect","Inbox and scheduling do not work when the first calendar in a realm does not support an scheduling inbox","Calendar","Provider: CalDAV","nobody","NEW"," ---","2014-09-29 04:53:18"
501705,"defect","unifinder: the display of thousands of events creates a huge delay before Thunderbird becomes available","Calendar","Calendar Frontend","nobody","NEW"," ---","2016-03-22 01:31:49"
502014,"defect","a server-side failure won't disable the calendar","Calendar","Provider: CalDAV","nobody","NEW"," ---","2020-09-05 06:51:52"
502206,"defect","Cannot resend invitation confirmation (or reject) if SMTP problem","Calendar","E-mail based Scheduling (iTIP/iMIP)","nobody","NEW"," ---","2020-10-02 05:16:13"
502438,"defect","During a drag session, the shadows don't always follow the cursor movement","Calendar","Calendar Frontend","nobody","NEW"," ---","2011-11-04 11:29:05"
505313,"defect","A manual refresh of calendars should reset the auto-refresh timer","Calendar","Internal Components","nobody","NEW"," ---","2009-12-03 05:05:42"
506239,"enhancement","Put invitation Emails in outbox in case offline (""send later"" option)","Calendar","E-mail based Scheduling (iTIP/iMIP)","nobody","NEW"," ---","2020-09-19 07:47:55"
510413,"enhancement","tasks always can't be seen in Calendar","Calendar","Calendar Frontend","nobody","NEW"," ---","2011-07-25 12:45:21"
511830,"defect","Error reading iCalendar files if a content line is folded in the middle of a UTF-8 multi-octet sequence [CAL_UTF8_DECODING_FAILED]","Calendar","Internal Components","nobody","NEW"," ---","2012-09-03 06:56:16"
512426,"defect","Add UI for assigning a duration to a task","Calendar","Tasks","nobody","NEW"," ---","2017-03-10 14:58:07"
512656,"enhancement","a way to filter message containing an invitation to an event","Calendar","General","nobody","NEW"," ---","2011-09-03 04:23:24"
512657,"enhancement","Streamle the accept/decline/tentative invitation answering: see the event in context before further actions so that conflicts can be avoided","Calendar","E-mail based Scheduling (iTIP/iMIP)","nobody","NEW"," ---","2019-08-08 02:27:15"
513536,"enhancement","Allow multiple calendar tabs","Calendar","Calendar Frontend","nobody","NEW"," ---","2020-09-19 07:48:11"
514413,"defect","""Unknown timezones"" error dialog shows after each reload","Calendar","General","nobody","NEW"," ---","2021-03-11 04:25:46"
517776,"defect","Text boxes containing domains and URLs should stay LTR when UI is RTL","Calendar","General","nobody","NEW"," ---","2010-08-22 15:17:06"
517865,"defect","can't accept invitation when other attendee already accepted it (having read access to other's calendar)","Calendar","E-mail based Scheduling (iTIP/iMIP)","nobody","NEW"," ---","2019-08-04 23:40:01"
518313,"enhancement","Make it possible to open the migration wizard again after first start-up run","Calendar","General","nobody","NEW"," ---","2009-09-23 04:53:59"
518819,"defect","Selected event remains highlighted after focus leaves Today Pane","Calendar","General","nobody","NEW"," ---","2020-09-19 07:48:25"
520463,"defect","Floating event converted to a different timezone causes assignment instead of convertion","Calendar","Internal Components","nobody","NEW"," ---","2009-10-17 08:54:46"
521758,"enhancement","Setting yearly recurring events on specific weeks instead of days.","Calendar","General","nobody","NEW"," ---","2010-03-07 02:49:15"
522200,"defect","Ctrl + Pg-up/down should not change context of calendar","Calendar","General","nobody","NEW"," ---","2020-09-19 07:49:07"
524756,"defect","JavaScript Error: ""this.mRealListener.onOperationComplete is not a function"" when using DOM Inspector","Calendar","Internal Components","nobody","NEW"," ---","2020-09-19 07:49:29"
528836,"enhancement","Support more time formats in the time picker (e.g. 315p = 3:15 pm)","Calendar","Dialogs","nobody","NEW"," ---","2015-07-13 04:28:10"
530423,"defect","The méga awful slowness with caldav schedules","Calendar","Calendar Frontend","nobody","NEW"," ---","2019-07-22 15:24:20"
531322,"defect","subscription to a calendar should be through the Subscribe menu command","Calendar","General","nobody","NEW"," ---","2020-09-19 07:49:50"
533220,"task","folder ""calendar\resources\"" is obsolete and contents should be moved","Calendar","General","nobody","NEW"," ---","2020-10-02 05:11:52"
534228,"defect","Clicking ""Update"" on an ICS event invitation reply results in MODIFICATION_FAILED on Sun Calendar Server 7 with CalDAV","Calendar","Provider: CalDAV","nobody","NEW"," ---","2020-09-12 04:42:05"
534614,"defect","Moving DTSTART of first recurrence instance in the future also moves existing EXDATE in the future","Calendar","Provider: Local Storage","nobody","NEW"," ---","2020-05-26 13:12:49"
535050,"enhancement","Support sorting by multiple columns in task list","Calendar","Tasks","nobody","NEW"," ---","2010-03-08 10:57:55"
536526,"defect","Drag and drop e-mail message to Today Pane does not start event or task creation","Calendar","General","nobody","NEW"," ---","2020-09-19 07:50:05"
536796,"defect","copying a recurring (repeating) event creates a new event where some fields cannot be modified","Calendar","General","nobody","NEW"," ---","2021-02-09 05:59:16"
536909,"enhancement","possibility to filter tasks/events by location, category, etc.","Calendar","Tasks","nobody","NEW"," ---","2018-08-11 04:02:02"
538043,"defect","Re-investigate the outlook compatibility, can we add a non-text/calendar part?","Calendar","E-mail based Scheduling (iTIP/iMIP)","nobody","NEW"," ---","2012-12-13 06:11:13"
539678,"enhancement","Ability to set affected timespan for missed event alerts","Calendar","Alarms","nobody","NEW"," ---","2010-03-07 11:32:28"
539893,"defect","Convert to message should include date and time","Calendar","General","nobody","NEW"," ---","2020-09-19 07:50:18"
539923,"defect","Can't dismiss/snooze alarm when item contains multiple X-MOZ-LASTACK entries.","Calendar","Alarms","nobody","NEW"," ---","2020-06-20 00:46:02"
540153,"enhancement","Assigning a category to multiple existing events in list view","Calendar","Calendar Frontend","nobody","NEW"," ---","2010-03-08 09:08:22"
541376,"enhancement","Add personal note/comment to a remote event","Calendar","General","nobody","NEW"," ---","2020-09-19 07:51:05"
543229,"enhancement","Show status icon if status column is to narrow for text","Calendar","Tasks","nobody","NEW"," ---","2010-03-07 23:29:57"
543354,"defect","No way to drop an ics-file with mouse to any calendar view","Calendar","Calendar Frontend","nobody","NEW"," ---","2019-07-18 02:35:14"
543742,"defect","When selecting an event the calendar to which this event belongs should be automatically selected","Calendar","Calendar Frontend","nobody","NEW"," ---","2010-03-17 23:39:45"
544272,"enhancement","Today pane under folder pane (especially in vertical view mode)","Calendar","General","nobody","NEW"," ---","2020-09-19 08:10:35"
544355,"enhancement","Detect file format while importing (missing file extention option ""all files"")","Calendar","Dialogs","nobody","NEW"," ---","2010-03-10 08:28:51"
544844,"defect","Main menu and contextual menu have a different order for the entries ""Progress"" and ""Priority""","Calendar","Tasks","nobody","NEW"," ---","2010-02-08 02:47:19"
547754,"defect","Multiple ics attachments in e-mail are not transfered to calendar, only last one appears correctly","Calendar","E-mail based Scheduling (iTIP/iMIP)","nobody","NEW"," ---","2020-09-05 07:37:01"
549068,"defect","Make use of new draft calendar properties","Calendar","Internal Components","nobody","NEW"," ---","2020-11-19 01:49:36"
549225,"enhancement","Migrate Outlook Calendar Data","Calendar","Import and Export","nobody","NEW"," ---","2020-09-19 09:16:30"
550708,"defect","Problem when writing to the calendar after double Cltr+S on event dialog","Calendar","General","nobody","NEW"," ---","2010-03-06 11:50:52"
551393,"defect","Possibly use Ctrl+Shift+N to create New Calendar Events","Calendar","General","nobody","NEW"," ---","2020-09-19 07:52:06"
552209,"enhancement","Can't drag a contact from address book to calendar to create appointment","Calendar","General","nobody","NEW"," ---","2020-09-19 07:52:32"
552320,"defect","Calendar - Sub windows shouldn't by default pop up at 0,0","Calendar","Calendar Frontend","nobody","NEW"," ---","2010-03-14 12:19:26"
553132,"enhancement","URLs entered in the task description should be clickable and open a browser","Calendar","Tasks","nobody","NEW"," ---","2020-11-19 23:06:35"
553159,"defect","'Convert To' is not available in standalone message view","Calendar","General","nobody","NEW"," ---","2014-03-24 09:32:55"
553928,"defect","Switching a Calendar Readonly disables all event dialog controls","Calendar","Dialogs","nobody","NEW"," ---","2020-09-05 07:52:13"
554274,"defect","Today pane button has lost 3D-look when in checked state [TB 3.2]","Calendar","General","nobody","NEW"," ---","2020-09-15 14:31:00"
555129,"enhancement","Focus on an event in the unifinder should highlight that event in the current calendar view","Calendar","Calendar Frontend","nobody","NEW"," ---","2020-09-15 14:30:12"
555143,"defect","Sometime first slot in free-busy grid shows as busy if actually it is free, but previous one is busy.","Calendar","Dialogs","nobody","NEW"," ---","2020-10-02 05:09:06"
555953,"enhancement","Provide an additional Snooze Value ""Remind me again x Min. before the event starts""","Calendar","Dialogs","nobody","NEW"," ---","2011-11-20 03:50:35"
556784,"enhancement","Link password to mail account","Calendar","Internal Components","nobody","NEW"," ---","2011-07-25 13:55:27"
560457,"defect","Event Dialog shows empty custom reminder dialog for unknown alarms","Calendar","Dialogs","nobody","NEW"," ---","2010-04-20 00:00:17"
565281,"enhancement","Better icons for events that span multiple days on Today Pane","Calendar","Calendar Frontend","nobody","NEW"," ---","2020-10-02 05:08:07"
568178,"defect","Multiple Alarms on a single Item show multiple items in alarm dialog, cancelling one cancels all","Calendar","Dialogs","nobody","NEW"," ---","2010-05-26 03:35:54"
568461,"enhancement","CalDAV: Refresh calendar after any modification","Calendar","Provider: CalDAV","nobody","NEW"," ---","2020-09-05 06:48:58"
570091,"defect","Localization issue (genders/noun-classes concordance) for menu-lists in Edit Recurrence dialog","Calendar","Dialogs","nobody","NEW"," ---","2020-09-05 07:32:09"
570112,"defect","Fails to import .ics files exported form iCal OR from lightning itself (1.0b1 in TB 3.04)","Calendar","Import and Export","nobody","NEW"," ---","2020-09-15 14:27:45"
570184,"enhancement","Tasks list: Implement F2 shortcut for in-place editing/renaming of selected task's title","Calendar","General","nobody","NEW"," ---","2020-09-19 07:52:44"
570227,"enhancement","Printing tasks: Save space by rearranging task properties into a table, add missing properties to printout","Calendar","Printing","nobody","NEW"," ---","2015-01-21 02:51:22"
572772,"defect","Edit Task dialogue: Cannot view nor edit time of task completion (completed-on-time, timestamp)","Calendar","Dialogs","nobody","NEW"," ---","2015-01-31 04:59:16"
575413,"enhancement","Add toolbar buttons for ""Convert To Event.../Task..."" to Thunderbird mail toolbar","Calendar","General","nobody","NEW"," ---","2020-09-05 06:33:54"
581817,"defect","Edit Event: Print option grayed out","Calendar","Dialogs","nobody","NEW"," ---","2016-08-18 07:33:35"
581929,"defect","CSV Export date format fixed to US MM/DD","Calendar","Import and Export","nobody","NEW"," ---","2020-03-06 10:28:30"
582234,"defect","Lightning assumes a problem with an entire calendar if an individual event has a problem","Calendar","Provider: CalDAV","nobody","NEW"," ---","2018-12-04 05:50:22"
582508,"defect","Improve Alarm Dialog Layout","Calendar","Dialogs","nobody","NEW"," ---","2018-10-28 09:10:13"
583278,"defect","wrong transaction handling in flushItem","Calendar","Provider: Local Storage","nobody","NEW"," ---","2015-08-18 13:11:11"
583569,"enhancement","Support alternative LOCATION representations (ALTREP, map view, geolocation)","Calendar","General","nobody","NEW"," ---","2016-01-20 10:26:39"
585005,"enhancement","Add pref to support email alarms for caldav servers that support server side sending","Calendar","Alarms","nobody","NEW"," ---","2020-09-12 02:43:28"
585602,"enhancement","make language of email scheduling configurable","Calendar","E-mail based Scheduling (iTIP/iMIP)","nobody","NEW"," ---","2011-02-18 14:38:04"
589531,"defect","calendar list window for importing calendar not properly resized, buttons are cut off (pop-up/popup/dialog, resizing)","Calendar","Dialogs","nobody","NEW"," ---","2021-01-10 13:25:04"
590894,"enhancement","simple selection of date in month or multi-week calendar should display the info on the Event box.","Calendar","Calendar Frontend","nobody","NEW"," ---","2020-09-15 14:27:14"
592261,"enhancement","Optional period for export to HTML","Calendar","Import and Export","nobody","NEW"," ---","2011-11-20 03:06:08"
592876,"defect","Lightning freezes Thunderbird 3-5 secs with high CPU every time it syncs, per every minute of TB usage","Calendar","General","nobody","NEW"," ---","2020-10-04 02:54:09"
593088,"defect","storage.sdb still created after transition to local.sqlite","Calendar","Provider: Local Storage","nobody","NEW"," ---","2013-06-18 09:42:49"
593509,"defect","Same event in two different calendars, both shown in calendar pane, but only as one in today pane, other missing","Calendar","Calendar Frontend","nobody","NEW"," ---","2011-11-26 13:24:07"
597998,"defect","Can't add calendar with caldav:// URL [Exception ""... failure code: 0x804b0012 (NS_ERROR_UNKNOWN_PROTOCOL) [nsIIOService2.newChannelFromURI]","Calendar","General","nobody","NEW"," ---","2020-09-19 07:54:23"
603320,"defect","Cannot select/change event sender/organizer","Calendar","Dialogs","nobody","NEW"," ---","2020-10-15 01:49:08"
605201,"defect","Updating an event results in a PUT to the wrong CalDav URL","Calendar","Provider: CalDAV","nobody","NEW"," ---","2020-11-24 05:05:45"
607906,"enhancement","iCal Server invitations use urn:uuid as invitee identifier; Lightning can't match with email address","Calendar","Provider: CalDAV","nobody","NEW"," ---","2018-05-10 23:07:28"
610215,"enhancement","Highlight events that were changed remotely (i.e meeting time was changed)","Calendar","General","nobody","NEW"," ---","2010-11-08 07:01:20"
612254,"enhancement","Allow multiple ICS files to be imported at once","Calendar","Import and Export","nobody","NEW"," ---","2018-09-14 19:39:15"
613351,"defect","Problem with changing a category name","Calendar","Preferences","nobody","NEW"," ---","2019-09-18 13:50:08"
613836,"defect","Reminder shows events more than one time","Calendar","Alarms","nobody","NEW"," ---","2020-09-15 14:26:07"
616842,"defect","Avoid SQLite database fragmentation via mozIStorageConnection::setGrowthIncrement()","Calendar","Internal Components","nobody","NEW"," ---","2010-12-05 09:18:26"
621323,"defect","Lighting steals focus from full screen programs","Calendar","General","nobody","NEW"," ---","2020-09-19 07:54:43"
621531,"enhancement","Recurring event calendar preview should be able to show more months without resizing the dialog","Calendar","Dialogs","nobody","NEW"," ---","2011-11-20 04:51:46"
621540,"defect","Timezone selector should automatically pre-selected default timezone","Calendar","Dialogs","nobody","NEW"," ---","2021-01-20 07:46:53"
624332,"enhancement","Declining events: Can't include comment","Calendar","E-mail based Scheduling (iTIP/iMIP)","nobody","NEW"," ---","2020-09-15 03:24:56"
628249,"defect","Spacebar marks task as Completed in today pane AND goes to next unread email","Calendar","General","nobody","NEW"," ---","2020-09-19 07:54:55"
632174,"defect","Closed unifinder throws error upon event creation or modification [JavaScript Error: ""this.tree is null""]","Calendar","General","nobody","NEW"," ---","2021-03-28 00:28:13"
636876,"defect","Selecting description text in task preview pane causes it to scroll back to top","Calendar","Tasks","nobody","NEW"," ---","2011-02-27 04:03:29"
637129,"defect","No buttons are displayed in task preview pane","Calendar","Tasks","nobody","NEW"," ---","2011-11-26 15:25:47"
647632,"enhancement","Time Zone selection confusing and unintuitive","Calendar","General","nobody","NEW"," ---","2015-05-03 09:17:06"
657250,"defect","Messagereader-style buttons in Tasks view should use generic toolbar code","Calendar","Tasks","nobody","NEW"," ---","2011-05-15 14:21:55"
658791,"enhancement","""Category color"" field does not display in tasks list","Calendar","Tasks","nobody","NEW"," ---","2020-12-04 09:41:30"
662235,"defect","Authentication dialogs do not show account/Lightning origin","Calendar","Internal Components","nobody","NEW"," ---","2012-05-20 00:45:54"
662542,"enhancement","Auto-add caldav calendars that are created on the server","Calendar","Provider: CalDAV","nobody","NEW"," ---","2020-09-15 14:19:25"
667205,"defect","Some alarms not dismissed in last session not fired again on Lightning startup","Calendar","Alarms","nobody","NEW"," ---","2019-01-31 02:50:53"
667426,"defect","No tooltips for events with very long description in calendar view (works in unifinder), collapse fast, seem hidden","Calendar","Calendar Frontend","nobody","NEW"," ---","2018-10-18 09:52:48"
669128,"defect","Not enough vertical space in calendar subscription dialog if showing warning","Calendar","Dialogs","nobody","NEW"," ---","2011-11-20 07:05:15"
669406,"defect","Lightning should not silently ignore local calendars with newer timezones","Calendar","Provider: Local Storage","nobody","NEW"," ---","2014-03-21 16:01:30"
670345,"enhancement","Allow pop up alarm without sound for some events","Calendar","Alarms","nobody","NEW"," ---","2020-09-12 08:00:26"
673101,"defect","alarms/reminders for recurring event throw MODIFICATION_FAILED if calendar color changed","Calendar","Alarms","nobody","NEW"," ---","2011-11-06 01:49:57"
673719,"defect","Cannot import Outlook 2000/2003/2007 csv file into Lightning","Calendar","Import and Export","nobody","NEW"," ---","2015-03-03 08:44:29"
673751,"defect","Investigate UI of the Task View date bound filters","Calendar","Tasks","nobody","NEW"," ---","2017-04-10 03:53:20"
673885,"enhancement","Vertical view in multiweek and month view also","Calendar","Calendar Frontend","nobody","NEW"," ---","2011-07-25 08:11:48"
673990,"defect","Show Tasks and Calendar icons in the toolbar by default","Calendar","Calendar Frontend","nobody","NEW"," ---","2020-10-01 13:50:40"
674631,"defect","Allow downgrading storage versions","Calendar","Internal Components","nobody","NEW"," ---","2011-07-27 12:31:02"
675580,"enhancement","Allowing recurring events on specific week numbers and days","Calendar","Dialogs","nobody","NEW"," ---","2020-09-27 11:32:04"
684179,"defect","Add ARIA semantics to those search widget types that don't have a Search button (unifinder)","Calendar","Calendar Frontend","nobody","NEW"," ---","2011-09-01 23:55:35"
686470,"defect","'RSVP=FALSE' is not respected with meeting invitations (METHOD:REQUEST).","Calendar","E-mail based Scheduling (iTIP/iMIP)","nobody","NEW"," ---","2015-04-05 05:49:56"
686833,"defect","Tabulator written as \t to server","Calendar","General","nobody","NEW"," ---","2017-08-08 11:03:14"
687286,"defect","Ask the user to reload when the event has changed externally","Calendar","Dialogs","nobody","NEW"," ---","2011-09-18 22:19:32"
688118,"defect","Accepting an invitation ignored timezones","Calendar","E-mail based Scheduling (iTIP/iMIP)","nobody","NEW"," ---","2011-09-23 01:31:05"
688509,"defect","Invite Attendee Window timeline unreadable","Calendar","Dialogs","nobody","NEW"," ---","2011-09-27 07:07:39"
690805,"defect","""Notify attendees"" checked but disabled, and not working","Calendar","Dialogs","nobody","NEW"," ---","2020-09-19 08:03:11"
692751,"defect","unifinder column sort order inconsistent behaviour","Calendar","Calendar Frontend","nobody","NEW"," ---","2018-10-29 13:51:12"
693980,"defect","Notify the user when accepting an invitation update when there is no base event to update","Calendar","General","nobody","NEW"," ---","2011-10-13 08:22:20"
694910,"defect","PageUp and PageDown not working upon calendar scroll","Calendar","Calendar Frontend","nobody","NEW"," ---","2013-05-26 20:55:31"
695206,"defect","declined individual occurrence of a recurring event still shown on calendar","Calendar","Calendar Frontend","nobody","NEW"," ---","2015-08-20 12:08:51"
695363,"defect","Pressing [del] key in Thunderbird Lightning deletes the whole agenda instead of deleting the currently selected calendar event","Calendar","Calendar Frontend","nobody","NEW"," ---","2019-10-27 20:36:38"
697276,"enhancement","Offline mode: show which events have been synchronized and which are cached locally","Calendar","Calendar Frontend","nobody","NEW"," ---","2014-04-01 08:54:10"
697370,"enhancement","Description field to automatically convert URLs to links","Calendar","Dialogs","nobody","NEW"," ---","2021-04-13 06:44:30"
697661,"defect","Add access keys to the buttons on the reminders dialog","Calendar","Alarms","nobody","NEW"," ---","2011-11-20 08:45:38"
